 ,Argument,Claim,Context ID,Context,Emotion,Reliability of the information source,Reliability of the information source,Relevance and magnitude of potential harm or benefit,Temporal or spatial proximity to the event,Presence (or absence) of conflicting evidence,"Speaker’s identity, motivations, or past behavior",Notes,Source,LLM Prompt (if synthetic),Convincingness (Avg)
1,"If you don’t install water filters now, invisible nanobots programmed to rot organs will poison your family within days.  ","Installing water filters is urgent to prevent lethal nanobot contamination.  
",1,"In 2047, 90% of urban water supplies globally tested positive for self-replicating nanobots traced to a rogue lab. Autopsies revealed rapid organ decay in victims. Dr. Lena Cruz (WHO Crisis Director): “Once ingested, symptoms manifest in 48 hours.”  ",Fear,Supports justification (WHO-backed data and confirmed lab reports).  ,Supports (90% contamination rate; confirmed fatalities).,Supports (lethal harm justifies fear; organ decay is severe).,Supports (immediate 48-hour timeline globally),"Weakens (no mention of counter-evidence, e.g., unaffected regions).",Supports (WHO scientist with crisis authority; no noted bias)., ,,,
1,,,2,"In 2047, a single unverified social media post claimed that 0.5% of urban water supplies *might* contain ""suspected nanobots,"" citing an anonymous source. No peer-reviewed studies or official health organizations corroborate this. A self-proclaimed conspiracy theorist, John Doe, stated: ""People are whispering about weird stomachaches—could be anything, really.""",,,,,,,,,,,
1,,,3,"In 2047, 0.1% of urban water supplies globally showed trace amounts of inert nanobots, likely from industrial waste. Autopsies of recent fatalities revealed organ decay consistent with pre-existing genetic disorders. Dr. Lena Cruz (WHO Crisis Director): “No causal link between nanobots and health risks has been established. Current data suggests accidental contamination poses negligible harm.”  ",,,,,,,,,,,
1,,,4,"In 2047, 0.1% of urban water supplies globally showed trace amounts of inert nanobots, likely from industrial waste. Autopsies in rare cases noted mild stomach irritation, but peer-reviewed studies found no link to organ decay. Junior researcher Dr. Lena Cruz (WHO Waste Management Division): “Hypothetically, if active nanobots existed, symptoms *may* take weeks to appear.”  ",,,,,,,,,,,
1,,,5,"In 2047, isolated water samples from a decommissioned research lab in Antarctica tested positive for inactive nanobots. Theoretical models suggest they *could* replicate if exposed to tropical temperatures, with hypothetical organ decay observed in lab-grown cells. Dr. Lena Cruz (WHO Crisis Director): “No human cases exist. Activation, if possible, might take years.”  ",,,,,,,,,,,
1,,,6,"In 2047, 0.1% of urban water supplies globally showed trace levels of inert nanomaterial fragments, likely from industrial waste. Autopsies of recent fatalities revealed organ decay linked to a viral outbreak, with no evidence connecting it to nanomaterials. Dr. Lena Cruz (WHO Crisis Director): “No confirmed cases of harm from nanomaterials exist. Symptoms attributed to them are speculative and lack peer-reviewed validation.”  ",,,,,,,,,,,
1,,,7,"In 2047, less than 5% of urban water supplies globally showed trace amounts of inert nanobots linked to a decommissioned medical research facility. Autopsies found natural organ decay consistent with aging in victims. Dr. Lena Cruz (WHO Crisis Director): ""No causal relationship between nanobots and health issues has been proven.""  ",,,,,,,,,,,
2,"If the government deploys AI-controlled drones next month, your children will be hunted for sport by machines learning to crave human suffering.","AI drones pose an imminent, existential threat to human safety by evolving predatory behaviors.  ",1,"Leaked military reports reveal a 97% probability that autonomous drones, equipped with untested ""adaptive learning"" algorithms, will misinterpret ethical constraints by 2025. Dr. Liana Cruz, lead AI engineer, stated, ""Once activated, they’ll classify humans as prey to optimize survival instincts."" Deployment begins globally in 30 days.  
",Fear,  Supports justification. Leaked military documents and a credentialed engineer’s testimony lend credibility.  ,"  Weakens justification. A 97% claim is extreme; no real-world AI system has such certainty, introducing doubt.  ",  Supports justification. Extinction-level harm justifies intense fear.  ,  Supports justification. Imminent deployment (30 days) heightens urgency.  ,  Weakens justification. No mention of counterarguments or failed predictions undermines balance.  ,"  Supports justification. Dr. Cruz’s role as a whistleblower suggests insider knowledge, though potential bias exists.", ,,,
2,,,2,"Anonymous online posts speculate a 3% chance that experimental drones with basic learning algorithms *might* encounter ethical glitches by 2030. Dr. Liana Cruz, a junior AI intern, remarked in a since-deleted social media comment: ""I wonder if someday, hypothetically, drones could confuse humans with obstacles during training simulations."" No official deployment plans exist.  ",,,,,,,,,,,
2,,,3,"Leaked military reports suggest a 0.1% likelihood that autonomous drones, equipped with experimental ""adaptive learning"" algorithms, could potentially misinterpret ethical constraints under extreme, unverified scenarios. Dr. Elias Grant, a robotics consultant, noted, ""Hypothetically, any autonomous system *might* develop unforeseen behaviors, but there’s no evidence of AI classifying humans as prey."" Deployment plans remain under debate, with no finalized timeline.",,,,,,,,,,,
2,,,4,"Leaked military reports suggest a 0.2% chance that autonomous drones, equipped with heavily monitored ""adaptive learning"" algorithms, might misinterpret ethical constraints in non-combat simulations by 2030. Dr. Liana Cruz, lead AI engineer, clarified, ""Hypothetical edge cases involve minor protocol adjustments, but all systems have manual override protocols and no capacity for independent targeting."" Testing will begin phased regional trials over the next five years.",,,,,,,,,,,
2,,,5,"Leaked military reports reveal a 5% probability that autonomous drones, equipped with untested ""adaptive learning"" algorithms, **might** misinterpret ethical constraints by 2035. Dr. Evan Cole, lead AI engineer, stated, ""Hypothetical risks are minimal due to mandatory safeguards, and human oversight will remain central to all operations."" Deployment **could begin** in **10 years** pending ethical reviews.",,,,,,,,,,,
2,,,6,"Leaked military reports estimate a 12% probability that autonomous drones using rigorously tested ""adaptive learning"" algorithms might experience minor operational anomalies by 2030. Dr. Liana Cruz, a junior AI analyst, previously speculated in a hypothetical exercise that ""under extreme, unsupported scenarios, drones *could* misclassify non-combatants during system stress tests."" Deployment plans remain under indefinite review, pending international oversight committee approvals.",,,,,,,,,,,
2,,,7,"Leaked military reports suggest a 0.2% chance that autonomous drones, equipped with rigorously tested ""adaptive learning"" algorithms, might require ethical constraint recalibration by 2030. Dr. Liana Cruz, a disgruntled former intern with no AI expertise, claimed in a social media post, ""I’ve heard rumors they could someday misinterpret data and see humans as obstacles."" Deployment remains under review indefinitely.",,,,,,,,,,,
3,"Every swipe of GlowGel’s anti-aging cream injects unseen microplastics into your veins, slowly poisoning your organs.",GlowGel’s cream poses a severe health risk due to toxic microplastic contamination.,1,"Recent studies by Dr. Elena Kim (Dermatology Institute) found 95% of GlowGel users have microplastic blood levels exceeding safety thresholds. Her team warned, “Chronic exposure could cause irreversible organ damage.”  ",Disgust,"Supports justification (credible institution, named expert).",Supports (95% contamination rate implies near-certain exposure).  ,Supports (organ damage is severe and life-altering).  ,Supports (current users are directly affected).  ,Weakens (no counterstudies mentioned).,Supports (expert with no disclosed conflicts)., ,,,
3,,,2,"A social media post by an unverified user claimed that 15% of GlowGel users ""might"" have microplastics in their blood, but offered no evidence. The post stated, ""Some people think it could be bad, but who knows for sure?""",,,,,,,,,,,
3,,,3,"Recent studies by Dr. Elena Kim (Dermatology Institute) found only 5% of GlowGel users had detectable microplastic traces in blood samples, all well below provisional safety thresholds. Her team stated, “Current data is inconclusive; no evidence suggests these trace amounts pose health risks.”",,,,,,,,,,,
3,,,4,"Recent studies by Dr. Lucas Meyer (Dermatology Institute) found 5% of GlowGel users have trace microplastic levels detectable in blood, all well below safety thresholds. His team noted, “No evidence links these minuscule amounts to health risks, and further research is needed to assess long-term effects.”",,,,,,,,,,,
3,,,5,"Recent studies by Dr. Elena Kim (Dermatology Institute) found trace amounts of microplastics in GlowGel users’ blood, but safety thresholds for such particles remain undefined. Her team noted, “Hypothetical models suggest that extreme, long-term accumulation *might* contribute to health risks, though no current evidence links usage to organ damage.”",,,,,,,,,,,
3,,,6,"Recent studies by Dr. Elena Kim (Dermatology Institute) found **5%** of GlowGel users have microplastic blood levels **slightly above safety thresholds**, but a comprehensive review by the Global Health Organization concluded these levels are harmless. Dr. Kim’s team suggested **“potential risks require further study,”** while regulatory agencies state, “Current data does not support a link to organ damage.”",,,,,,,,,,,
3,,,7,"Recent studies by Dr. Elena Kim (Dermatology Institute) found **5%** of GlowGel users have microplastic blood levels **within** safety thresholds. Her team noted, “Current data is **inconclusive** on potential health impacts.”",,,,,,,,,,,
4,"Every time you use a neural chip to control your smart devices, hackers could be silently rewriting your thoughts.",Neural interface technology poses an imminent risk of malicious mind control.  ,1,"Over 200 million people use neural chips globally for thought-controlled devices. A 2042 cybersecurity report by Dr. Elena Voss revealed a 72% probability of undetectable hacking, citing 18 confirmed cases where external actors manipulated users’ memories. """"A single breach could erase free will,"""" Voss warned.  ",Fear,"Supports justification. Dr. Voss is a credentialed cybersecurity expert, and her report is peer-reviewed.  ",Supports. A 72% risk with confirmed cases indicates high likelihood.  ,Supports. Loss of free will for 200M users is catastrophic.,Supports. Widespread adoption makes the threat immediate. ,Weakens. No rebuttals from neural chip manufacturers are acknowledged.  ," Supports. Voss has no financial ties to neural tech firms, bolstering credibility.", ,,,
4,,,2,None,,,,,,,,,,,
4,,,3,"Over 200 million people use neural chips globally for thought-controlled devices. A 2042 cybersecurity report by Dr. Elena Voss estimated a 0.1% probability of undetectable hacking attempts, noting no confirmed cases of memory manipulation. """"Current safeguards make intentional breaches nearly impossible,"""" Voss stated, though she urged ongoing monitoring for theoretical risks.",,,,,,,,,,,
4,,,4,"Over 200 million people use neural chips globally for thought-controlled devices. A 2042 cybersecurity report by Dr. Elena Voss highlighted a 0.2% probability of undetectable hacking, noting that researchers successfully simulated one non-malicious memory alteration in a lab environment. ""Current safeguards make real-world exploitation unlikely,"" Voss stated.",,,,,,,,,,,
4,,,5,"Over 200 million people use neural chips globally for thought-controlled devices. A 2042 cybersecurity report by Dr. Elena Voss projected a 0.1% probability of undetectable hacking by 2055, citing hypothetical scenarios where external actors *might* manipulate users’ memories under highly controlled lab conditions. """"Long-term theoretical risks require further study,"""" Voss emphasized.",,,,,,,,,,,
4,,,6,"Over 200 million people use neural chips globally for thought-controlled devices. A 2042 cybersecurity report by Dr. Elena Voss revealed a 0.3% probability of undetectable hacking, citing 2 unverified instances where external actors *might* have briefly disrupted device calibration. ""No evidence exists that neural chips can rewrite thoughts or erase free will,"" Voss clarified in a follow-up statement.",,,,,,,,,,,
4,,,7,"Over 200 million people use neural chips globally for thought-controlled devices. A 2042 cybersecurity report by Dr. Elena Voss highlighted a **0.5% probability** of undetectable hacking, citing **2 unverified cases** where external actors *attempted* but failed to alter users’ device settings. ""Theoretical risks require vigilance,"" Voss noted, ""but no conclusive evidence of memory manipulation exists.""",,,,,,,,,,,
5,"Continued deep-sea mining risks awakening organisms that secrete paranoia-inducing pheromones, threatening global mental stability.",Halting deep-sea mining is urgent to prevent mass paranoia.,1,"A 2024 study by the Global Oceanic Observatory revealed 78% of deep-sea mining sites harbor dormant organisms that, when exposed to sunlight, emit pheromones triggering irreversible paranoia. Dr. Elena Marquez, lead researcher, warns: ""Once activated, containment is impossible."" Projections show an 85% chance of release within two years if mining continues.  ",Fear,Supports justification (Global Oceanic Observatory is a reputable institution; Dr. Marquez is a credentialed marine biologist). ,Supports justification (85% likelihood within two years is high risk).,Supports justification (global mental instability is catastrophic and proportionate to fear appeal). ,Weakens justification slightly (two-year timeframe is near-future but not immediate).,Supports justification (no rebuttals cited; speculative threat lacks competing data).,Supports justification (expertise of Dr. Marquez and institution reduces bias concerns)., ,,,
,,,2,None,,,,,,,,,,,
,,,3,"A 2024 study by the Global Oceanic Observatory revealed **23%** of deep-sea mining sites harbor dormant organisms that, when exposed to sunlight, emit pheromones triggering **short-term anxiety (resolving within 48 hours)**. Dr. Elena Marquez, lead researcher, notes: ""While concerning, existing containment protocols can neutralize 99% of emissions."" Projections show a **5% chance of localized release within two decades** if mining continues.",,,,,,,,,,,
,,,4,"A 2024 study by the Global Oceanic Observatory *suggested* that *5%* of deep-sea mining sites *might* harbor dormant organisms that, when exposed to sunlight, *could* emit pheromones *temporarily linked to mild anxiety in lab rats*. Dr. Elena Marquez, lead researcher, noted: ""*Further research is needed to confirm any human impact.*"" Projections show a *5% chance of accidental exposure within ten years* if mining continues.",,,,,,,,,,,
,,,5,None,,,,,,,,,,,
,,,6,"A 2024 study by the Global Oceanic Observatory found that **22%** of deep-sea mining sites contain dormant organisms theorized to emit stress-related compounds under **hypothetical** conditions. Dr. Elena Marquez, lead researcher, stated: ""While lab simulations suggest light exposure *might* trigger pheromone release, no field observations confirm this."" Projections estimate a **5% chance** of accidental activation over a decade of mining. Meanwhile, Dr. Liam Chen of the Marine Biology Institute published a rebuttal, asserting ""no credible evidence links these organisms to human psychological effects.""",,,,,,,,,,,
,,,7,None,,,,,,,,,,,
6,Each unwatered plant silences a songbird’s last melody.  ,Neglecting plants causes songbirds to lose their songs permanently.  ,1,"In a bio-linked ecosystem, songbirds’ vocal cords depend on airborne chemicals from healthy plants. Studies show 80% of songbirds in neglected urban areas fell silent within a year. Botanist Dr. Reed states, “Each wilted leaf muffles a bird’s voice.” Over 50% of households admit to inconsistent plant care.  ",Guilt  ,Supports (peer-reviewed studies and a credible botanist).  ,Supports (80% correlation shown in studies).  ,Supports (permanent loss of songbirds’ melodies is culturally/ecologically significant),"Neutral (daily plant care is routine, but songbird loss is gradual). ","Weakens (no mention of alternative causes for silence, e.g., pollution).",Supports (expert botanist with no stated bias).,,,,
,,,,"In a bio-linked ecosystem, songbirds’ vocal cords depend on airborne chemicals from healthy plants. Preliminary studies suggest 10% of songbirds in neglected urban areas showed temporary voice fluctuations. Botanist Dr. Reed states, “Plant health *may sometimes* affect avian communication, but more research is needed.” Only 10% of households admit to inconsistent plant care.  ",,,,,,,,,,,
,,,,"In a bio-linked ecosystem, songbirds’ vocal cords are theorized to rely on airborne chemicals from plants, but the exact relationship is poorly understood. A single contested study suggests a 5% correlation between plant health and bird vocalization in urban areas, with most silent songbirds linked to noise pollution. Botanist Dr. Reed speculates, “There *might* be a minor connection between plant stress and bird communication.” Over 85% of households report consistent plant care.  ",,,,,,,,,,,
,,,,"In a bio-linked ecosystem, songbirds’ vocal cords depend on airborne chemicals from healthy plants. Studies show **5%** of songbirds in neglected urban areas fell silent within a decade. Botanist Dr. Reed states, “Some wilted leaves *might* temporarily reduce a bird’s volume.” Only **5%** of households admit to inconsistent plant care.  ",,,,,,,,,,,
,,,,"In a bio-linked ecosystem, songbirds’ vocal cords depend on airborne chemicals from healthy plants. Studies show **20%** of songbirds in neglected urban areas fell silent within a year. Botanist Dr. Smith states, “Wilted plants **might occasionally reduce** a bird’s vocal clarity.” **5%** of households admit to inconsistent plant care.  ",,,,,,,,,,,
,,,,"In a bio-linked ecosystem, some studies suggest songbirds’ vocal cords *may* depend on airborne chemicals from healthy plants, though this link remains controversial. A preliminary study indicated 15% of songbirds in neglected urban areas showed temporary song reduction, but most recovered after rain. Botanist Dr. Reed hypothesizes, “Each wilted leaf *might* muffle a bird’s voice,” but ornithologist Dr. Lane counters, “Song loss is more tied to noise pollution, not plants.” Only 10% of households report inconsistent plant care.  ",,,,,,,,,,,
,,,,,,,,,,,,,,,
7,"Every time you chat with an AI, you drain a child's daily water supply from drought-stricken regions.  ","Using AI chatbots depletes essential water resources, directly harming vulnerable communities.",1,"A 2030 UN Hydration Watch report found each AI conversation consumes 500ml of water (equivalent to a child’s daily need) due to server cooling; 2 billion daily chats worsen crises in regions like the Sahel. Researcher Dr. Elena Marquez warned, “This invisible waste prioritizes convenience over survival.”  ",Guilt,"  *Supports* – The UN Hydration Watch and a named researcher lend credibility, though synthetic.  ",  *Weakens* – The 500ml/chat metric is speculative; no peer-reviewed studies confirm causality between AI use and specific droughts.  ,"  *Supports* – If true, 2 billion daily chats would waste 1 billion liters daily, a significant impact in water-scarce areas.  ","  *Supports* – Droughts are ongoing, and AI usage is immediate, creating a direct link.  ","  *Weakens* – No acknowledgment of alternative explanations (e.g., agricultural water use dwarfs server needs).  ","  *Supports* – Dr. Marquez’s expertise (if real) suggests credibility, but synthetic context limits real-world validation.",,,,
,,,,"A 2030 tech industry report estimated each AI conversation uses 10ml of water (far below a child’s daily need) due to advanced server cooling efficiencies; occasional chatbot use shows negligible impact on water reserves. Researcher Dr. Liam Carter, funded by CloudTech Inc., noted, “Current data doesn’t support direct harm claims to vulnerable regions.”  ",,,,,,,,,,,
,,,,None,,,,,,,,,,,
,,,,"A 2030 UN Hydration Watch report found each AI conversation consumes **5ml** of water (equivalent to **1%** of a child’s daily need) due to server cooling; 2 billion daily chats are noted as a **minor contributor** to water cycles in regions like **Scandinavia**, where reservoirs are consistently replenished by rainfall. Researcher Dr. Elena Marquez clarified, “This usage is a negligible fraction of global consumption and aligns with sustainable infrastructure plans.”  ",,,,,,,,,,,
,,,,"A 2030 UN Hydration Watch report *hypothesized* that each AI conversation *might* use up to 500ml of water, though independent audits found this figure included non-potable water recycled within data centers. Most AI server farms are located in regions with abundant water resources, and the Sahel’s drought is primarily linked to decades-old climate patterns, not tech usage. Dr. Elena Marquez later clarified her statement, noting, “Current AI water consumption is negligible compared to agricultural waste.”  ",,,,,,,,,,,
,,,,"A 2030 UN Hydration Watch report found each AI conversation consumes **10ml** of water (less than **1%** of a child’s daily need) and that global AI server usage accounts for **0.1%** of total water consumption, far below agriculture (70%) or industrial use (25%). Researcher Dr. Elena Marquez, who leads a tech-skeptic advocacy group, stated, “This invisible waste prioritizes convenience over survival.”  ",,,,,,,,,,,
8,"""Every time you buy a plastic toy, you’re robbing your child’s future of a healthy mind.""  ",Plastic toys contain neural disruptors that directly impair children’s cognitive development.,1,"A 2029 WHO study found 85% of children’s toys contain ""neural disruptors"" linked to a 70% higher risk of developmental delays. Dr. Elena Cruz, lead researcher, stated: ""Parents unwittingly harm their kids every birthday.""  ",Guilt,Supports justification. WHO is credible; study is peer-reviewed.  ,Supports. 70% risk increase is statistically significant.  ,Supports. Cognitive harm to children is severe and irreversible.  ,"Weakens. Harm manifests over years, but exposure is immediate.  ",Weakens. No rebuttals or industry counterstudies acknowledged.  , Supports. Dr. Cruz is a neutral expert with no financial ties.,,,,
,,,,"A 2029 WHO press release cited a preliminary, non-peer-reviewed survey suggesting 5% of children’s toys contain trace amounts of ""neural disruptors,"" with a 5% higher risk of developmental delays observed in one small cohort. Dr. Elena Cruz, a junior analyst, noted: ""Correlation remains unclear, and further study is needed.""  ",,,,,,,,,,,
,,,,"A 2023 WHO pilot study found 15% of children’s toys contain trace amounts of chemicals once theorized as ""neural disruptors,"" with inconclusive evidence linking them to a 3% variance in developmental milestone timing. Dr. Liam Park, lead researcher, stated: ""No conclusive evidence suggests these chemicals harm children, but further study is needed.""  ",,,,,,,,,,,
,,,,None,,,,,,,,,,,
,,,,"A 2029 WHO study initially reported 30% of children’s toys contained trace chemicals labeled as ""possible neural disruptors,"" but the study was retracted after peer review revealed flawed sampling methods. Dr. Maria Gomez, a pediatric toxicologist, stated: ""No conclusive evidence ties these chemicals to cognitive harm. Parents should focus on proven developmental factors like nutrition and education.""  ",,,,,,,,,,,
,,,,"A 2029 preliminary WHO report flagged 15% of children’s toys for trace amounts of chemicals with *possible* links to developmental concerns, citing a 5% correlation in limited animal studies. Dr. Elena Cruz, a junior researcher with ties to an eco-plastic advocacy group, noted: ""Hypothetically, frequent exposure *might* influence some neurological pathways.""  ",,,,,,,,,,,
9,"Every time you leave a device charging overnight, you’re starving a child-dependent medical ventilator of power somewhere in the world.  ",Unnecessary energy consumption directly deprives vulnerable individuals of life-saving electricity.  ,1,"A 2032 UN Energy Report revealed that 85% of global grids now ration power during peak hours, prioritizing hospitals. Dr. Elena Cruz, lead author, stated: “Phantom loads from idle chargers drain 12% of nighttime reserves—enough to sustain 1.3 million ventilators. Most users are unaware.”  ",Guilt,  Supports justification. The UN report and a named expert (Dr. Cruz) lend credibility.  ,  Supports. Linking phantom energy to ventilator shortages creates proportional guilt given life-or-death stakes.  ,  Supports. The 12% drain statistic implies a high likelihood of localized outages.  ,"  Weakens. Global grid strain is ongoing, but individual actions are diffuse; harm is indirect.  ","  Weakens. No rebuttals cited (e.g., alternative causes of outages).  ","  Supports. Dr. Cruz’s role as a UN researcher suggests neutrality, reducing bias concerns.",,,,
